Downloading cpython-3.11.14-linux-x86_64-gnu (download) (29.1MiB)
 Downloaded cpython-3.11.14-linux-x86_64-gnu (download)
Using CPython 3.11.14
Creating virtual environment at: .venv
Resolved 108 packages in 161ms
   Building d-radam-experiment @ file:///home/runner/work/test-matsuzawa-20251217-4/test-matsuzawa-20251217-4
Downloading nvidia-nccl-cu12 (307.4MiB)
Downloading nvidia-cufft-cu12 (184.2MiB)
Downloading triton (162.5MiB)
Downloading nvidia-nvshmem-cu12 (118.9MiB)
Downloading nvidia-cuda-nvrtc-cu12 (84.0MiB)
Downloading nvidia-curand-cu12 (60.7MiB)
Downloading nvidia-nvjitlink-cu12 (37.4MiB)
Downloading numpy (16.1MiB)
Downloading nvidia-cuda-cupti-cu12 (9.8MiB)
Downloading matplotlib (8.3MiB)
Downloading pillow (6.7MiB)
Downloading sympy (6.0MiB)
Downloading sqlalchemy (3.2MiB)
Downloading fonttools (4.8MiB)
Downloading networkx (2.0MiB)
Downloading pydantic-core (2.0MiB)
Downloading kiwisolver (1.4MiB)
Downloading nvidia-cufile-cu12 (1.1MiB)
Downloading nvidia-cudnn-cu12 (674.0MiB)
Downloading torchvision (7.7MiB)
Downloading wandb (21.8MiB)
Downloading nvidia-cusparse-cu12 (274.9MiB)
Downloading torch (858.1MiB)
Downloading pandas (12.2MiB)
Downloading nvidia-cusparselt-cu12 (273.9MiB)
Downloading nvidia-cublas-cu12 (566.8MiB)
Downloading nvidia-cusolver-cu12 (255.1MiB)
 Downloaded nvidia-cufile-cu12
 Downloaded kiwisolver
 Downloaded pydantic-core
      Built d-radam-experiment @ file:///home/runner/work/test-matsuzawa-20251217-4/test-matsuzawa-20251217-4
 Downloaded sqlalchemy
 Downloaded networkx
 Downloaded fonttools
 Downloaded pillow
 Downloaded torchvision
 Downloaded matplotlib
 Downloaded nvidia-cuda-cupti-cu12
 Downloaded sympy
 Downloaded numpy
 Downloaded nvidia-nvjitlink-cu12
 Downloaded pandas
 Downloaded nvidia-curand-cu12
 Downloaded wandb
 Downloaded nvidia-cuda-nvrtc-cu12
 Downloaded nvidia-nvshmem-cu12
 Downloaded nvidia-cufft-cu12
 Downloaded triton
 Downloaded nvidia-cusolver-cu12
 Downloaded nvidia-cusparse-cu12
 Downloaded nvidia-cusparselt-cu12
 Downloaded nvidia-nccl-cu12
 Downloaded nvidia-cublas-cu12
 Downloaded nvidia-cudnn-cu12
 Downloaded torch
Prepared 70 packages in 31.02s
Installed 70 packages in 281ms
 + alembic==1.17.2
 + annotated-types==0.7.0
 + antlr4-python3-runtime==4.9.3
 + certifi==2025.11.12
 + charset-normalizer==3.4.4
 + click==8.3.1
 + colorlog==6.10.1
 + contourpy==1.3.3
 + cycler==0.12.1
 + d-radam-experiment==0.1.0 (from file:///home/runner/work/test-matsuzawa-20251217-4/test-matsuzawa-20251217-4)
 + filelock==3.20.1
 + fonttools==4.61.1
 + fsspec==2025.12.0
 + gitdb==4.0.12
 + gitpython==3.1.45
 + greenlet==3.3.0
 + hydra-core==1.3.2
 + idna==3.11
 + jinja2==3.1.6
 + kiwisolver==1.4.9
 + mako==1.3.10
 + markupsafe==3.0.3
 + matplotlib==3.10.8
 + mpmath==1.3.0
 + networkx==3.6.1
 + numpy==2.3.5
 + nvidia-cublas-cu12==12.8.4.1
 + nvidia-cuda-cupti-cu12==12.8.90
 + nvidia-cuda-nvrtc-cu12==12.8.93
 + nvidia-cuda-runtime-cu12==12.8.90
 + nvidia-cudnn-cu12==9.10.2.21
 + nvidia-cufft-cu12==11.3.3.83
 + nvidia-cufile-cu12==1.13.1.3
 + nvidia-curand-cu12==10.3.9.90
 + nvidia-cusolver-cu12==11.7.3.90
 + nvidia-cusparse-cu12==12.5.8.93
 + nvidia-cusparselt-cu12==0.7.1
 + nvidia-nccl-cu12==2.27.5
 + nvidia-nvjitlink-cu12==12.8.93
 + nvidia-nvshmem-cu12==3.3.20
 + nvidia-nvtx-cu12==12.8.90
 + omegaconf==2.3.0
 + optuna==4.6.0
 + packaging==25.0
 + pandas==2.3.3
 + pillow==12.0.0
 + platformdirs==4.5.1
 + protobuf==6.33.2
 + pydantic==2.12.5
 + pydantic-core==2.41.5
 + pyparsing==3.2.5
 + python-dateutil==2.9.0.post0
 + pytz==2025.2
 + pyyaml==6.0.3
 + requests==2.32.5
 + seaborn==0.13.2
 + sentry-sdk==2.48.0
 + six==1.17.0
 + smmap==5.0.2
 + sqlalchemy==2.0.45
 + sympy==1.14.0
 + torch==2.9.1
 + torchvision==0.24.1
 + tqdm==4.67.1
 + triton==3.5.1
 + typing-extensions==4.15.0
 + typing-inspection==0.4.2
 + tzdata==2025.3
 + urllib3==2.6.2
 + wandb==0.23.1
2025-12-17 11:39:54,713 - INFO - Using device: cpu
2025-12-17 11:39:54,713 - INFO - Run ID: comparative-1-resnet20-alpaca
2025-12-17 11:39:54,713 - INFO - Mode: trial
2025-12-17 11:39:54,714 - INFO - Configuration validation passed
2025-12-17 11:39:54,714 - INFO - Loading dataset: alpaca-cleaned
2025-12-17 11:39:54,714 - INFO - Loading CIFAR-10 dataset
  0%|          | 0.00/170M [00:00<?, ?B/s]  0%|          | 32.8k/170M [00:00<09:39, 294kB/s]  0%|          | 229k/170M [00:00<02:31, 1.12MB/s]  1%|          | 885k/170M [00:00<00:53, 3.19MB/s]  2%|▏         | 3.54M/170M [00:00<00:14, 11.4MB/s]  5%|▍         | 8.00M/170M [00:00<00:07, 22.5MB/s]  7%|▋         | 12.5M/170M [00:00<00:05, 29.6MB/s] 10%|█         | 17.2M/170M [00:00<00:04, 33.5MB/s] 13%|█▎        | 21.4M/170M [00:00<00:04, 36.1MB/s] 15%|█▌        | 26.1M/170M [00:00<00:03, 38.7MB/s] 18%|█▊        | 30.9M/170M [00:01<00:03, 41.3MB/s] 21%|██        | 35.1M/170M [00:01<00:03, 41.6MB/s] 23%|██▎       | 39.6M/170M [00:01<00:03, 42.6MB/s] 27%|██▋       | 45.3M/170M [00:01<00:02, 44.6MB/s] 30%|███       | 51.3M/170M [00:01<00:02, 49.0MB/s] 33%|███▎      | 56.2M/170M [00:01<00:02, 48.7MB/s] 36%|███▌      | 61.1M/170M [00:01<00:02, 47.3MB/s] 39%|███▉      | 67.1M/170M [00:01<00:02, 51.0MB/s] 42%|████▏     | 72.3M/170M [00:01<00:01, 49.6MB/s] 45%|████▌     | 77.3M/170M [00:02<00:01, 48.7MB/s] 49%|████▉     | 83.6M/170M [00:02<00:01, 49.2MB/s] 53%|█████▎    | 90.3M/170M [00:02<00:01, 54.0MB/s] 56%|█████▌    | 95.7M/170M [00:02<00:01, 51.9MB/s] 59%|█████▉    | 101M/170M [00:02<00:01, 51.0MB/s]  62%|██████▏   | 106M/170M [00:02<00:01, 49.4MB/s] 66%|██████▌   | 113M/170M [00:02<00:01, 50.0MB/s] 70%|██████▉   | 119M/170M [00:02<00:00, 53.2MB/s] 73%|███████▎  | 124M/170M [00:02<00:00, 51.8MB/s] 76%|███████▌  | 129M/170M [00:03<00:00, 50.7MB/s] 79%|███████▉  | 135M/170M [00:03<00:00, 49.7MB/s] 83%|████████▎ | 141M/170M [00:03<00:00, 50.1MB/s] 87%|████████▋ | 148M/170M [00:03<00:00, 50.4MB/s] 90%|█████████ | 154M/170M [00:03<00:00, 50.8MB/s] 94%|█████████▍| 160M/170M [00:03<00:00, 50.9MB/s] 98%|█████████▊| 167M/170M [00:03<00:00, 50.6MB/s]100%|██████████| 170M/170M [00:03<00:00, 44.4MB/s]
2025-12-17 11:40:01,800 - INFO - Dataset loaded: train=256, val=256, test=256
2025-12-17 11:40:01,800 - INFO - Building model: ResNet-20-cifar
2025-12-17 11:40:01,809 - INFO - Model has 272,474 trainable parameters
2025-12-17 11:40:01,849 - INFO - Model output shape verified
2025-12-17 11:40:01,850 - INFO - Optimizer: radam
2025-12-17 11:40:01,850 - INFO - Learning rate: 0.01
2025-12-17 11:40:01,850 - INFO - WandB disabled (trial mode)
2025-12-17 11:40:01,850 - INFO - Starting training...
2025-12-17 11:40:01,850 - INFO - 
=== Epoch 1/1 ===
2025-12-17 11:40:02,789 - INFO - Train Loss: 5.6010, Train Acc: 10.94%
2025-12-17 11:40:02,789 - INFO - Val Loss: 5.8961, Val Acc: 10.16%
2025-12-17 11:40:03,014 - INFO - 
=== Final Results ===
2025-12-17 11:40:03,014 - INFO - Best Val Accuracy (Epoch 1): 10.16%
2025-12-17 11:40:03,014 - INFO - Final Test Accuracy: 8.98%
2025-12-17 11:40:03,014 - INFO - Final Test Loss: 6.0165
2025-12-17 11:40:03,014 - INFO - Total Wall-Clock Time: 0.94 seconds
2025-12-17 11:40:03,014 - INFO - Convergence Speed @ Epoch 20: 0.0000
2025-12-17 11:40:03,014 - INFO - Convergence Speed @ Epoch 100: 0.0000
2025-12-17 11:40:03,015 - INFO - Results saved to: .research/results/comparative-1-resnet20-alpaca/training_metrics.json
2025-12-17 11:40:03,015 - INFO - Training complete!
